"","baseMean","log2FoldChange","lfcSE","stat","pvalue","padj"
"...1",361.737651947606,0.203194544908171,0.680856224752253,0.298439725629458,0.76536757299147,0.959363148817073
"AA1 Laccase / p-diphenol:oxygen oxidoreductase / ferroxidase (EC 1.10.3.2)",4443.63283355016,-0.119985485318768,0.249793685523852,-0.480338344290574,0.630986827769829,0.930784145009184
"AA10 (formerly CBM33) proteins are copper-dependent lytic polysaccharide monooxygenases (LPMOs)",158.726866730057,-0.626391958399627,0.454798228029401,-1.37729639166301,0.16842063038215,0.742192608463712
"AA12 The pyrroloquinoline quinone-dependent oxidoreductase activity was demonstrated for the CC1G_09525 protein of Coprinopsis cinerea.",204.659575652529,-0.131481221702973,0.241173890892282,-0.54517187252951,0.585635314739656,0.930784145009184
"AA2 manganese peroxidase (EC 1.11.1.13)",3373.09901346387,-0.0890298289626196,0.185919684761727,-0.478861768062479,0.632036970952052,0.930784145009184
"AA3 cellobiose dehydrogenase (EC 1.1.99.18)",5482.62356786666,-0.0643301659005592,0.171650649899707,-0.374773797466811,0.707828702916842,0.948636405971026
"AA4 vanillyl-alcohol oxidase (EC 1.1.3.38)",845.327459044199,0.131097966316614,0.169860491659682,0.771797873865043,0.440234151199294,0.930784145009184
"AA5 Oxidase with oxygen as acceptor (EC 1.1.3.-)",624.512816796891,0.138117802888831,0.263291291405888,0.524581736643577,0.599873985540804,0.930784145009184
"AA6 1,4-benzoquinone reductase (EC. 1.6.5.6)",456.304538784458,-0.118513300523717,0.42818678663321,-0.276779443512435,0.781949466467266,0.959363148817073
"AA7 glucooligosaccharide oxidase (EC 1.1.3.-)",2918.08422154889,-0.0242131601784154,0.228244226122843,-0.106084436788266,0.915515359105381,0.997934936377768
"CBM11 Modules of approx. 180-200 residues. The CBM11 of Clotridium thermocellum Cel26A-Cel5E has been shown to bind both beta-1,4-glucan and beta-1,3-1,4-mixed linked glucans.",47.511314371466,-0.531402940397355,0.681649748897184,-0.779583563636739,0.435636033611041,0.930784145009184
"CBM13 Modules of approx. 150 residues which always appear as a threefold internal repeat. The only apparent exception to this, xylanase II of Actinomadura sp. FC7 (GenBank U08894), is in fact not completely sequenced. These modules were first identified in several plant lectins such as ricin or agglutinin of Ricinus communis which bind galactose residues. The three-dimensional structure of a plant lectin has been determined and displays a pseudo-threefold symmetry in accord with the observed sequence threefold repeat. These modules have since been found in a number of other proteins of various functions including glycoside hydrolases and glycosyltransferases. While in the plant lectins this module binds mannose, binding to xylan has been demonstrated in the Streptomyces lividans xylanase A and arabinofuranosidase B. Binding to GalNAc has been shown for the corresponding module of GalNAc transferase 4. For the other proteins, the binding specificity of these modules has not been established. The pseudo three-fold symmetry of the CBM13 module has now been confirmed in the 3-D structure of the intact, two-domain, xylanase of Streptomyces olivaceoviridis.",2069.5171453071,-0.999043185606938,0.41785145944942,-2.39090510039937,0.0168068964652118,0.388548430580361
"CBM16 Carbohydrate-binding module 16. Binding to cellulose and glucomannan demonstrated [B. Bae et al (2008) J Biol Chem. 283:12415-25 (PMID: 18025086)]",77.6554970434612,-0.228584909853445,0.501280116323404,-0.456002347609519,0.64838829005795,0.930784145009184
"CBM2 Modules of approx. 100 residues and which are found in a large number of bacterial enzymes. The cellulose-binding function has been demonstrated in many cases. Several of these modules have been shown to also bind chitin or xylan.",2094.06622306815,-0.848505878535716,0.411470814932267,-2.06212894753031,0.0391954610406156,0.509540993528003
"CBM20 The granular starch-binding function has been demonstrated in several cases. Interact strongly with cyclodextrins. Often designated as starch-binding domains (SBD).",111.13770815963,0.355154267534293,0.451279835345046,0.78699343449003,0.431285709557915,0.930784145009184
"CBM22 A xylan binding function has been demonstrated in several cases and affinity with mixed beta-1,3/beta-1,4-glucans in one. In several cases a thermostabilizing effect has also been seen.",161.248245606083,-0.896744208729229,0.610018413364505,-1.47002809928853,0.141554143838176,0.721648576429916
"CBM23 Mannan-binding function demonstrated in one case.",16.9712095345268,-3.07929026523349,1.63255243519788,-1.8861815393147,0.0592704953296136,0.571987757444284
"CBM3 Modules of approx. 150 residues found in bacterial enzymes. The cellulose-binding function has been demonstrated in many cases. In one instance binding to chitin has been reported.",9.48445482067373,0.0397718349540435,1.15740464553558,0.0343629473991261,0.972587729703016,0.997934936377768
"CBM32 Binding to galactose and lactose has been demonstrated for the module of Micromonospora viridifaciens sialidase (PMID: 16239725). Binding to polygalacturonic acid has been shown for a Yersinia member (PMID: 17292916). Binding to LacNAc (beta-D-galactosyl-1,4-beta-D-N-acetylglucosamine) has been shown for an N-acetylglucosaminidase from Clostridium perfingens (PMID: 16990278).",450.555857076811,-0.405167524007191,0.293728892977887,-1.37939281321464,0.167773673895785,0.742192608463712
"CBM34 Modules of approx. 120 residues. Granular starch-binding function has been demonstrated in the case of Thermoactinomyces vulgaris R-47 alpha-amylase 1 (TVAI).",10.1313219156331,-2.32063173293021,0.992715850659031,-2.33765959452508,0.0194049137939397,0.388548430580361
"CBM35 Modules of approx. 130 residues. A module that is conserved in three Cellvibrio xylan-degrading enzymes binds to xylan and the interaction is calcium dependent, while a module from a Cellvibrio mannanase binds to decorated soluble mannans and mannooligosaccharides. A module in a Phanerochaete chrysosporium galactan 1,3-beta-galactosidase binds to beta-galactan.",292.943790408412,0.202838193050278,0.377516887843117,0.53729568022549,0.5910633888561,0.930784145009184
"CBM37 Modules of approx. 100 residues, conserved in numerous R. albus polysaccharide-degrading enzymes and other proteins from this bacterium. Several members of CBM37 have been shown to exhibit rather broad binding specificity to xylan, chitin, microcrystalline and phosphoric-acid swollen cellulose, as well as more heterogeneous substrates, such as alfalfa cell walls, banana stem and wheat straw.",4.39092558144135,0.760240203446195,2.00480172825722,0.379209670827187,0.704532170671808,0.948636405971026
"CBM38 The inulin-binding function has been demonstrated in the case of the cycloinulo-oligosaccharide fructanotransferase from Paenibacillus macerans (Bacillus macerans) by Lee et al. (2004) FEMS Microbiol Lett 234:105-10. (PMID:15109727).",389.991735859615,-0.251219353096522,0.343285839518811,-0.73180808578839,0.4642857131083,0.930784145009184
"CBM4 Modules of approx. 150 residues found in bacterial enzymes. Binding of these modules has been demonstrated with xylan, beta-1,3-glucan, beta-1,3-1,4-glucan, beta-1,6-glucan and amorphous cellulose but not with crystalline cellulose.",36.3251160732117,-0.237075831293929,0.744936161727991,-0.318249862839248,0.75029541227106,0.959363148817073
"CBM40 Modules of approx. 200 residues, found at the N-terminus of GH33 sialidases. Can also be found inserted in the beta-propeller of GH33 sialidases. The sialic acid binding function has been demonstrated for the N-terminal CBM40 of Vibrio cholerae sialidase (Moustafa et al. (2004) J Biol Chem 279:40819-26) (PMID: 15226294).",6.6677767807116,-0.942873303522841,1.37381079793421,-0.686319619077557,0.492511579884952,0.930784145009184
"CBM41 Modules of approx. 100 residues found in primarily in bacterial pullulanases. The N-terminal module from Thermotoga maritima Pul13 has been shown to bind to the alpha-glucans amylose, amylopectin, pullulan, and oligosaccharide fragments derived from these polysaccharides (Lammerts van Bueren et al. (2004) Biochemistry 43:15633-42) (PMID: 15581376).",139.036887599714,0.0260786715664901,0.392139842566073,0.0665034988432628,0.946976972204461,0.997934936377768
"CBM42 Modules of approx. 160 residues found mostly at the C-terminus of GH54 catalytic domains. Binding to arabinofuranose (present in arabinoxylan) has been demonstrated.",118.089503100787,-0.100943596151686,0.425652857122469,-0.237150049535888,0.812540385682249,0.968439238444377
"CBM44 The C-terminal CBM44 module of the Clostridium thermocellum enzyme has been demonstrated to bind equally well cellulose and xyloglucan",66.5438260314366,-0.0260958482509383,0.602845378962078,-0.0432877967744692,0.965472118868273,0.997934936377768
"CBM46 Modules of approx. 100 residues, found at the C-terminus of several GH5 cellulases. Cellulose-binding function demonstrated in one case.",5.89615007436409,-1.22794014995791,1.75079178670542,-0.701362754430443,0.483076659638758,0.930784145009184
"CBM47 Modules of approx 150 residues. Fucose-binding activity demonstrated",43.9770408892241,0.444387664283058,0.673046204128687,0.66026323535745,0.509084918621771,0.930784145009184
"CBM48 Modules of approx. 100 residues with glycogen-binding function, appended to GH13 modules. Also found in the beta subunit (glycogen-binding) of AMP-activated protein kinases (AMPK)",872.385170000073,0.0877054177314026,0.186607021507454,0.470000630324081,0.638354567229728,0.930784145009184
"CBM5 Modules of approx. 60 residues found in bacterial enzymes. Chitin-binding described in several cases. Distantly related to the CBM12 family.",2.28198587710751,0.444618789540919,2.66652251957692,0.166741059292259,0.867573797114159,0.985018284933106
"CBM50 Modules of approx. 50 residues found attached to various enzymes from families GH18, GH19, GH23, GH24, GH25 and GH73, i.e. enzymes cleaving either chitin or peptidoglycan. Binding to chitopentaose demonstrated in the case of Pteris ryukyuensis chitinase A [Ohnuma T et al. (2008) J. Biol. Chem. 283:5178-87 (PMID: 18083709)]. CBM50 modules are also found in a multitude of other enzymes targeting the petidoglycan such as peptidases and amidases. These enzymes are not reported in the list below.",1624.72547156483,-0.0801344875275018,0.343853407458565,-0.233048403154644,0.815723820074302,0.968439238444377
"CBM51 Modules of approx. 150 residues found attached to various enzymes from families GH2, GH27, GH31, GH95, GH98 and GH101 . Binding to galactose and to blood group A/B-antigens demonstrated in the case of C. perfringens GH95CBM51 and GH98CBM51 respectively [Gregg KJ et al. (2008) J. Biol. Chem. 283:12604-13 PMID: 18292090].",92.0306253751875,-0.833853221997184,0.322143092723042,-2.58845600242026,0.00964072620246856,0.278509868071314
"CBM56 beta-1,3-glucan binding function demonstrated by Yamamoto et al. (1998) FEBS Letters 433:41-43 [PMID: 9738929]",17.9692804216581,-0.812209440611809,0.796740064507004,-1.01941583810572,0.3080055901852,0.92263602646325
"CBM57 Created from reading Schallus et al (2008) Mol Biol Cell. 19:3404-3414 [PMID: 18524852] and finding related domains attached to various glycosidases.",112.639812701008,0.393196266887933,0.517216499760564,0.760216016058954,0.447125472996333,0.930784145009184
"CBM6 Modules of approx. 120 residues. The cellulose-binding function has been demonstrated in one case on amorphous cellulose and beta-1,4-xylan. Some of these modules also bind beta-1,3-glucan, beta-1,3-1,4-glucan, and beta-1,4-glucan.",1084.84678202622,-0.403467996996813,0.366219255003705,-1.10171158802868,0.270587077485328,0.857833397609734
"CBM60 Modules of approx 120 residues usually found appended to xylanases. The xylan-binding function and the relatedness (circular permutation) to family CBM36 has been demonstrated [PMID: 20659893].",38.2260335659987,-0.953089449586709,0.629124205551653,-1.51494639878144,0.129785978827025,0.703007385313053
"CBM61 Modules of approx. 150 residues found appended to GH16, GH30, GH31, GH43, GH53 and GH66 catalytic domains. A beta-1,4-galactan binding function has been demonstrated for the CBM61 of Thermotoga maritima GH53 galactanase [PMID: 20826814].",287.928463982383,-1.77425428831875,0.777077555887572,-2.28323965204761,0.0224162556104054,0.388548430580361
"CBM63 The CBM63 module of Bacillus subtilis expansin EXLX1 has been shown to bind cellulose.",3.06685870794134,-2.87625566038915,2.0594891124958,-1.39658697049558,0.162537810682859,0.742192608463712
"CBM66 The CBM66 module, derived from the Bacillus subtilis exo-acting beta-fructosidase SacC, targets the terminal fructoside residue of fructans.",68.1559687770671,-0.224022371070911,0.536854415507157,-0.41728700481914,0.676468492585875,0.940544428194265
"CBM67 Fujimoto et al. [PMID : 23486481] disclosed the L-rhamnose binding activity and 3-D structure of the CBM67 of Streptomyces avermitilis alpha-L-rhamnosidase (SaRha78A)",408.494095393324,-0.265895938387447,0.334886623992425,-0.793987933042861,0.427202456286413,0.930784145009184
"CBM68 Binding to maltotriose and maltotetraose shown for the pullulanase of Anoxybacillus sp. LM18-11. Binding function derived from crystal structure and deletion of the CBM, which showed reduced specific activity and increased Km value compared to the wild type enzyme.",105.125539990362,-1.90464107611351,1.0242935946968,-1.85946791620552,0.0629608428554076,0.571987757444284
"CBM71 The two CBM71s of S. pneumoniae BgaA bind lactose and LacNAc.",3.5127630279037,0.0341871048730918,2.69201359674086,0.0126994547555336,0.989867573473802,0.997934936377768
"CBM77 Pectin binding modules of approx. 110 residues. The Ruminococcus flavefaciens CBM77 was shown to bind various pectins of low degree of esterification.",86.1530779234361,-0.418124606445514,1.53956203684887,-0.271586721702569,0.785939810377064,0.959363148817073
"CBM8 The cellulose-binding module from a cellulase of the slime mold Dictyostelium discoideum has been experimentally shown to bind cellulose.",17.2480490820021,-2.00224474103715,0.919228954809468,-2.17817849466259,0.0293927504853154,0.446704624899673
"CBM85",5.03535591938962,-2.46273019490579,1.59719622865893,-1.54190834583525,0.123095867587354,0.695759251580695
"CBM88 Binding to terminal galactose in galactoxyloglucan and galactomannan",20.2430681346153,-0.771380937860863,1.24590244211488,-0.61913430119895,0.535827888169554,0.930784145009184
"CBM9 Modules of approx. 170 residues found so far only in xylanases. The cellulose-binding function has been demonstrated in one case.",349.562876068035,-0.167761017368071,0.362251417474201,-0.46310658640837,0.643287969183538,0.930784145009184
"CBM91 Binding to xylans (birchwood and oat spelt)",383.628016564359,0.0320446239281875,0.284151481831455,0.112773031207329,0.910210499898598,0.997934936377768
"CE1 acetyl xylan esterase (EC 3.1.1.72)",1456.58326194594,0.0363511105065871,0.16747042976977,0.217059874728696,0.828161683777068,0.972957208693973
"CE11 UDP-3-0-acyl N-acetylglucosamine deacetylase (EC 3.5.1.108).",1379.41992389745,0.0838224161222834,0.18175132679008,0.461192870515311,0.64466023628041,0.930784145009184
"CE12 pectin acetylesterase (EC 3.1.1.-)",248.407612456956,-0.899746828864016,0.557405948745435,-1.61416797020034,0.106490997413751,0.695759251580695
"CE13 pectin acetylesterase (EC 3.1.1.-)",77.324095771855,0.231390892229438,0.783004711949786,0.295516602516023,0.767599271395765,0.959363148817073
"CE14 N-acetyl-1-D-myo-inosityl-2-amino-2-deoxy-alpha-D-glucopyranoside deacetylase (EC 3.5.1.89)",1741.98050156034,-0.139110297886639,0.276497638895197,-0.503115680996345,0.614882942445573,0.930784145009184
"CE15 4-O-methyl-glucuronoyl methylesterase (EC 3.1.1.-)",116.68542378636,-0.280162834233577,0.395827381184096,-0.70779043479884,0.47907540723368,0.930784145009184
"CE16 acetylesterase (EC 3.1.1.6) active on various carbohydrate acetyl esters",24.701498614784,-0.598671117219705,0.87921278535074,-0.680917210480373,0.495923877397327,0.930784145009184
"CE17 acetylmannan esterase (3.1.1.-)",12.1500940040078,0.034135742976782,1.99646775402121,0.0170980687807389,0.986358379577755,0.997934936377768
"CE18 N-acetylgalactosamine deacetylase (EC 3.5.1.-)",1.11400287700905,0.0982928738677206,3.00891863673839,0.0326671757313678,0.973939999885056,0.997934936377768
"CE19",91.7297499345089,-0.267849302887431,0.486389811673148,-0.550688555679338,0.581847191150585,0.930784145009184
"CE2 acetyl xylan esterase (EC 3.1.1.72).",17.81882681377,-0.44017457662345,0.772597436997125,-0.569733415547285,0.568858522367442,0.930784145009184
"CE20",33.2407394983159,0.895565350533219,0.616974772329988,1.45154290045141,0.146628745347613,0.733143726738066
"CE3 acetyl xylan esterase (EC 3.1.1.72).",51.1407551499248,-0.531666876806423,0.594050511951525,-0.894985975283205,0.370794585132287,0.930784145009184
"CE4 acetyl xylan esterase (EC 3.1.1.72)",2143.38283180575,-0.165853734912763,0.267247699466865,-0.62059929886628,0.534863301105769,0.930784145009184
"CE5 acetyl xylan esterase (EC 3.1.1.72)",17.0198526469098,-0.511058346743432,1.05505828764073,-0.48438873257537,0.628110013341928,0.930784145009184
"CE6 acetyl xylan esterase (EC 3.1.1.72).",2.3885550521984,-4.65347860160759,2.48358536977093,-1.87369383724337,0.0609726358403632,0.571987757444284
"CE7 acetyl xylan esterase (EC 3.1.1.72)",79.3519678538006,0.304069165061545,0.388983431936529,0.78170209859005,0.43438966806938,0.930784145009184
"CE8 pectin methylesterase (EC 3.1.1.11).",667.039356972731,-0.402379561898827,0.644399676480386,-0.624425456102902,0.532348211552098,0.930784145009184
"CE9 N-acetylglucosamine 6-phosphate deacetylase (EC 3.5.1.25)",254.312541039981,-0.296436299068755,0.351953767214425,-0.842259201868845,0.399642882247432,0.930784145009184
"GH1 beta-glucosidase (EC 3.2.1.21)",1486.84664535593,-0.128699494640999,0.217300988992319,-0.592263731692211,0.553673998362428,0.930784145009184
"GH10 endo-1,4-beta-xylanase (EC 3.2.1.8)",1319.75422839147,-0.791397629881718,0.304335696776467,-2.60041013349478,0.00931124032479512,0.278509868071314
"GH102 peptidoglycan lytic transglycosylase (EC 3.2.1.-)",81.6582984995597,-0.582339647340796,0.475479936715243,-1.22474073535841,0.2206729207698,0.784480134656498
"GH103 peptidoglycan lytic transglycosylase (EC 3.2.1.-)",346.445868549131,0.0623028114828892,0.229368130024765,0.271628022062883,0.785908050791436,0.959363148817073
"GH104 peptidoglycan lytic transglycosylase (EC 3.2.1.-)",7.97786567241965,-3.73815221057377,2.09579362224754,-1.78364518857776,0.0744813378394236,0.605160869945317
"GH105 unsaturated rhamnogalacturonyl hydrolase (EC 3.2.1.172)",209.456959133616,0.582612849773696,0.515521771004917,1.13014208621684,0.258416358260371,0.829484606761685
"GH106 alpha-L-rhamnosidase (EC 3.2.1.40)",191.236181230725,-0.197636165495298,0.262442022045307,-0.753066006560407,0.451410250438656,0.930784145009184
"GH108 N-acetylmuramidase (EC 3.2.1.17)",8.56356231262754,0.0678007890965193,1.21758315992683,0.0556847296578854,0.955592964593905,0.997934936377768
"GH109 alpha-N-acetylgalactosaminidase (EC 3.2.1.49)",3574.51110001319,-0.179077447236142,0.400439158165663,-0.447202636366689,0.654728758047857,0.930784145009184
"GH11 endo-beta-1,4-xylanase (EC 3.2.1.8)",141.087873946438,-0.83549324338416,0.537647373609428,-1.5539799586022,0.120189197229601,0.695759251580695
"GH113 beta-mannanase (EC 3.2.1.78)",28.9302551177406,-0.272052459898561,0.580666322718016,-0.468517717068767,0.63941440416177,0.930784145009184
"GH114 endo-alpha-1,4-polygalactosaminidase (EC 3.2.1.109)",36.819400986911,-0.16518908638623,0.538599244726065,-0.306701296007658,0.759070743227369,0.959363148817073
"GH115 xylan alpha-1,2-glucuronidase (3.2.1.131)",85.5713155351125,-1.17731943295222,0.47725010278808,-2.46688146545041,0.0136295467399827,0.35436821523955
"GH116 beta-glucosidase (EC 3.2.1.21)",28.2929900698197,0.368223171454315,0.642538472567846,0.573075679006029,0.566593453835788,0.930784145009184
"GH117 beta-D-galactofuranosidase (EC 3.2.1.146)",20.56284451543,-0.220711991933132,0.752181607273694,-0.293429126422154,0.769194165071795,0.959363148817073
"GH12 endoglucanase (EC 3.2.1.4)",110.303087993059,-0.827940376876127,0.423467171019908,-1.95514654626487,0.050565775674543,0.571613116320921
"GH120 beta-xylosidase (EC 3.2.1.37)",135.712528188772,0.310352904266632,0.436708773621378,0.710663313890059,0.477292898467152,0.930784145009184
"GH121 beta-L-arabinobiosidase (EC 3.2.1.-)",68.0417377201308,0.138917392162003,0.726731609846437,0.191153639500223,0.848405224109284,0.972957208693973
"GH123 beta-N-acetylgalactosaminidase (EC 3.2.1.53)",2.46514068822734,5.35053595127733,2.50442002291632,2.13643714006359,0.0326437995118991,0.446704624899673
"GH125 exo-alpha-1,6-mannosidase (EC 3.2.1.163)",10.2247464256369,-1.95708951146735,1.662110376907,-1.17747265082917,0.239006907288414,0.807036310324514
"GH127 beta-L-arabinofuranosidase (EC 3.2.1.185)",281.954734414139,-0.364748525229339,0.255992285412893,-1.42484186443756,0.154202917704223,0.742192608463712
"GH128 beta-1,3-glucanase (EC 3.2.1.39)",1.07661985907292,1.6189361979028,3.25154956338321,0.497896823143703,0.618556766581261,0.930784145009184
"GH13 alpha-amylase (EC 3.2.1.1)",12360.2148656876,-0.0351009477174952,0.233693288877035,-0.150200923125202,0.880606097609346,0.991158378261601
"GH130 beta-1,4-mannosylglucose phosphorylase (EC 2.4.1.281)",111.953717809667,0.369106158176152,0.455572578949502,0.810202754141324,0.41782365484452,0.930784145009184
"GH133 amylo-alpha-1,6-glucosidase (EC 3.2.1.33)",233.057612161994,-0.138230080305086,0.388666391054194,-0.355652259847217,0.722101001412527,0.959363148817073
"GH135 alpha-1,4-galactosaminogalactan hydrolase (EC 3.2.1.-)",27.749310098123,0.184827340239644,0.787293446760851,0.23476296036767,0.814392717689001,0.968439238444377
"GH136 lacto-N-biosidase (EC 3.2.1.140)",151.739005081599,0.110831195370116,0.565911890903261,0.195845320007707,0.844731236641836,0.972957208693973
"GH138 rhamnogalacturonan alpha-1,2-galacturonohydrolase (EC 3.2.1.173)",1.67925041574516,2.72471301283094,2.62439255766048,1.03822616204181,0.299164775345713,0.915571432589692
"GH140 beta-1,2-apiosidase (EC 3.2.1.-)",58.2551090240223,-0.673096543140853,0.432678443643619,-1.55565074486414,0.119791164979114,0.695759251580695
"GH141 alpha-L-fucosidase (EC 3.2.1.51)",87.5796998557379,-1.19206767487817,0.519634633259524,-2.29404970065344,0.0217876440836683,0.388548430580361
"GH142 beta-L-arabinofuranosidase (EC 3.2.1.185)",7.52103697261404,2.5223255715764,2.00094007835233,1.26057026837775,0.207463716203566,0.783864653032311
"GH143 2-keto-3-deoxy-D-lyxo-heptulosaric acid hydrolase (EC 3.2.1.-)",0.551356789643891,0.0341219938559702,3.58322994342461,0.00952269164823921,0.992402106188356,0.997934936377768
"GH144 endo-beta-1,2-glucanase (EC 3.2.1.71)",108.86863879668,0.319064793590026,0.32063344334538,0.995107653964643,0.31968390845066,0.92263602646325
"GH146 beta-L-arabinofuranosidase (EC 3.2.1.185)",24.8003016057281,-0.303547695478816,0.667268477931022,-0.454910887473685,0.649173349859923,0.930784145009184
"GH147 beta-galactosidase (EC 3.2.1.23)",6.03490801128887,1.06028995161371,1.41832552375431,0.74756459913879,0.45472282441563,0.930784145009184
"GH148 beta-1,3-glucanase (EC 3.2.1.-)",6.55315343630048,-1.18896986780465,1.782543788804,-0.667007383085042,0.504767417458239,0.930784145009184
"GH15 glucoamylase (EC 3.2.1.3)",3953.34132065181,-0.0706778345152754,0.216300257810745,-0.32675797629939,0.743850946201793,0.959363148817073
"GH151 alpha-L-fucosidase (EC 3.2.1.51)",18.4228043158294,0.190269040503408,0.93816243895046,0.202810337105657,0.839283278003128,0.972957208693973
"GH154 beta-glucuronidase (3.2.1.31)",44.2904664389171,0.418794075681313,0.647724166271253,0.646562375605314,0.517915215226338,0.930784145009184
"GH157 endo-beta-1,3-glucanase / laminarinase (EC 3.2.1.39)",25.5314415045667,-1.05116709739537,0.775821121638204,-1.35490909963337,0.175446520104646,0.750610314121544
"GH158 endo-beta-1,3-glucanase (EC 3.2.1.39)",120.263177696202,0.151002797052515,0.501063038875243,0.301364868962351,0.763136280274725,0.959363148817073
"GH159 beta-D-galactofuranosidase (EC 3.2.1.146)",2.34359878395295,2.49279891372125,4.84245655247326,0.514779820264586,0.606706888302176,0.930784145009184
"GH16 xyloglucan:xyloglucosyltransferase (EC 2.4.1.207)",487.500219734844,0.307110773564538,0.207447329693915,1.48042770190233,0.138759141721425,0.72154753695141
"GH163 endo-beta-N-acetylglucosaminidase cleaving GlcNAc-beta-1,2-Man (EC 3.2.1.-)",3.08716811671663,1.68882475891139,2.10662833081443,0.801671910611059,0.422742768383292,0.930784145009184
"GH164 beta-mannosidase (EC 3.2.1.25)",1.252755090472,-0.162707175087099,3.40156814876577,-0.0478329899538059,0.961849344457649,0.997934936377768
"GH165 beta-galactosidase (EC 3.2.1.23)",14.8091052364752,0.290167972611813,1.0364907283014,0.279952308967915,0.779514094292663,0.959363148817073
"GH166 alpha-1,4-galactosaminogalactan hydrolase (EC 3.2.1.-)",2.65520924656373,-3.8782723350422,2.31686590902879,-1.67393042468648,0.0941442739333613,0.695759251580695
"GH167 beta-carrageenase (EC 3.2.1.-)",103.753982946219,3.64390386162316,1.32070664646006,2.75905620024709,0.00579685648075305,0.278509868071314
"GH17 glucan endo-1,3-beta-glucosidase (EC 3.2.1.39)",110.131019553107,-0.260031664231949,0.373879929753689,-0.695495113640513,0.486745072361751,0.930784145009184
"GH170 6-phospho-N-acetylmuramidase (EC 3.2.1.-)",43.5888985450204,-4.90858807873112,1.80008672511107,-2.72686199517874,0.00639397749517718,0.278509868071314
"GH171 peptidoglycan beta-N-acetylmuramidase (EC 3.2.1.92)",228.581961740339,0.133920809207922,0.265503747552703,0.504402707842524,0.613978415586122,0.930784145009184
"GH172 difructose-anhydride-I synthase (EC 4.2.1.179 (old 3.2.1.134))",129.553778661014,-0.223962339404001,0.35718113788573,-0.627027341728363,0.530641312788724,0.930784145009184
